title,author,date,abstract,column,url
Economic diversity is not enough ,Sonia Green,2023-09-22,Diversifying Duke is an issue of and not or. Striving for economic diversity does not mean we shouldn't also strive to make campus racially diverse as well.,STUDENT VOICES COLUMNS,https://www.dukechronicle.com/article/2023/09/092223-green-duke-socioeconomic-diversity
I was a FGLI student at Duke 50 years ago. Not much has changed since,Diane Weddington,2023-09-21,To come to Duke as a first-generation student is to come to a foreign country not knowing the language or customs and to struggle daily to understand.,LETTERS TO THE EDITOR,https://www.dukechronicle.com/article/2023/09/092123-weddington
On race-conscious affirmative action,Lauren Liu,2023-09-21,"In simple terms, DEI in the college process essentially attaches a certain “value” to our race, which backtracks the progress made by civil rights activists decades ago.",STUDENT VOICES COLUMNS,https://www.dukechronicle.com/article/2023/09/092123-liu-race-conscious-affirmative-action
Are you with us or against us?,Chloe Decker,2023-09-21,"By letting go of monitoring the telltale signs of my peers’ political beliefs, I came to appreciate the input of every member. We had all come to class prepared, asked tough questions and treated each other with dignity.",STUDENT VOICES COLUMNS,https://www.dukechronicle.com/article/2023/09/are-you-with-us-or-against-us
So casually cruel in the name of being honest,Advikaa Anand,2023-09-21,We no longer find fault in a general crudity towards the words we speak and discount the value of politeness.,STUDENT VOICES COLUMNS,https://www.dukechronicle.com/article/2023/09/092123-anand-casually-cruel-in-the-name-of-being-honest
Wisdom from clinical year on the wards,Nathan Luzum,2023-09-20,"There’s a jack-of-all-trades aspect to clinical year that’s necessarily uncomfortable — in this environment requiring frequent shifts from specialty to specialty, change is the only constant.",STUDENT VOICES COLUMNS,https://www.dukechronicle.com/article/2023/09/092023-luzum-clinical-year-wisdom
The (misused) power of elite college admissions ,Aaron Price,2023-09-19,"If Duke, and our peer institutions, decided that the main basis for undergraduate admissions was students’ ability to play ping pong, suddenly every ambitious high schooler in the country would be practicing their serve.",STUDENT VOICES COLUMNS,https://www.dukechronicle.com/article/2023/09/091923-price-elite-college-admissions
We just want hoodies,Bodhaansh Ravipati,2023-09-19,Selling simple products like sweatshirts for heinous prices not only signals to low-income to middle-income students that we don’t belong but also enforces the isolated social climates we experience.,GUEST COLUMNS,https://www.dukechronicle.com/article/2023/09/091923-ravipati-cheaper-hoodies
Duke’s lack of low-income students implicates all of us,Robert Carlson,2023-09-19,"All of us — Duke students, faculty, staff, alumni and administrators — need to make changes for first-generation and low-income students to feel welcome on campus.",GUEST COLUMNS,https://www.dukechronicle.com/article/2023/09/091923-carlson-low-income-students-lack
Duke students advocate to protect Dreamers,Define America,2023-09-18,"DACA gives recipients the opportunity to pursue a better life, allowing them to prosper and thrive in the country they call home. Dreamers deserve to be protected. ",LETTERS TO THE EDITOR,https://www.dukechronicle.com/article/2023/09/091823-define-america-daca-ruling
Why I chose not to study abroad during my junior fall ,Barbara Cardenas,2023-09-18,My decision wasn't just about choosing to stay; it was about investing in the sense of home that Duke had become.,STUDENT VOICES COLUMNS,https://www.dukechronicle.com/article/2023/09/091823-cardenas-junior-fall-on-campus
Maybe you should be passionate about work,Heidi Smith,2023-09-18,"It’s possible to not be passionate about your job and find passion in other endeavors. You’re probably going to enjoy your life a lot less, though.",STUDENT VOICES COLUMNS,https://www.dukechronicle.com/article/2023/09/smith-091823-maybe-you-should-be-passionate-about-work
Duke is actually good for low-income students,Angikar Ghosal,2023-09-18,The New York Times casts us into the roles of pugilistic adversaries within the theater of a class-based struggle.,STUDENT VOICES COLUMNS,https://www.dukechronicle.com/article/2023/09/091823-ghosal-duke-is-good-for-low-income-students
"East, West and the void in between",Aaron Siegle,2023-09-15,"Despite its current state of disrepair, Duke can leverage the prime location of Central Campus to create one, coherent, walkable campus that serves as a gateway between Duke and Durham.",STUDENT VOICES COLUMNS,https://www.dukechronicle.com/article/2023/09/091423-siegle-central-campus
Talk is overrated,Valerie Tan,2023-09-15,"As we ease into the rhythm of the new academic year, I find myself, once again, in the company of my old friend, social anxiety.",STUDENT VOICES COLUMNS,https://www.dukechronicle.com/article/2023/09/091523-tan-talk-is-overrated
Freshman year is meant to suck,Susan Chemmanoor,2023-09-15,"So, in the next few months, I'm not going to demand from myself that I join 12 labs and save the world, but instead, fall down, get back up and try again.",STUDENT VOICES COLUMNS,https://www.dukechronicle.com/article/2023/09/freshman-year-is-meant-to-suck
"In the last 16 days, I’ve started college and my brother has been in two lockdowns",Bella Naspinski,2023-09-14,Fearing for your own life or the life of a loved one is possibly one of the most terrifying feelings you will never want to experience.,STUDENT VOICES COLUMNS,https://www.dukechronicle.com/article/2023/09/091423-naspinski-unc-gun-violence-threats
Duke students need to be creative,Anna Garziera,2023-09-13,"Imagine a world where all those students really were in touch with their creativity, and were able to solve problems effectively — those students would own the future. ",STUDENT VOICES COLUMNS,https://www.dukechronicle.com/article/2023/09/091223-garziera-duke-creativity
Burning Man in a burning world,Morgan Foster,2023-09-12,"We must keep events like Burning Man in check and accountable for their impact, encouraging them to strive for better. ",STUDENT VOICES COLUMNS,https://www.dukechronicle.com/article/2023/09/091223-foster-burning-man-environment
"Duke is not rich, just comfortable",Monday Monday,2023-09-11,"President Price seems to have forgotten that most students at Duke do not speak broke. Therefore, I, Monday Monday, champion of the vernacular of the common (top 1%) man, have taken it upon myself to translate the announcement into more accessible language.",STUDENT VOICES COLUMNS,https://www.dukechronicle.com/article/2023/09/091123-monday-monday-duke-socioeconomic-diversity
A legacy of advocacy,Luke A. Powery,2023-09-11,"On a day of remembrance such as Sept. 11, I hope you will be remembered for a legacy of advocacy.",STUDENT VOICES COLUMNS,https://www.dukechronicle.com/article/2023/09/091123-powery-911-advocacy
A eulogy for Panda Express,James Gao,2023-09-08,Eating at Panda Express was both a fundamental part of my Duke experience and a respite from all things Duke.,STUDENT VOICES COLUMNS,https://www.dukechronicle.com/article/2023/09/090823-gao-panda-express-eulogy
Blood on your hands: A response to the UNC Chapel Hill shooting,Caroline Cornett,2023-09-07,We had our first day of classes ripped apart by reports of a shooting less than 30 minutes from campus — a shooting that sent our brothers and sisters at UNC into lockdown.,GUEST COLUMNS,https://www.dukechronicle.com/article/2023/09/090723-cornett-unc-shooting-response
A potential fifth fundamental force,Monika Narain,2023-09-07,"Although particle physics seeks to describe the most fundamental aspects of the universe, the fundamentals of physics themselves are always subject to change in response to new information.",STUDENT VOICES COLUMNS,https://www.dukechronicle.com/article/2023/09/090723-narain-a-fifth-force
A love letter to Duke Engage Boston: Turning 'sorry' into 'thank you',Advikaa Anand,2023-09-07,"I realized that while I felt I was being polite, I was actually apologizing for the kindness people showed me instead of appreciating it. ",STUDENT VOICES COLUMNS,https://www.dukechronicle.com/article/2023/09/090723-anand-a-love-letter-to-duke-engage-boston
STEM students are privileged at Duke,Sonia Green,2023-09-06,"As a self-proclaimed anti-STEM student, I started to see the benefits of pursuing the STEM path at Duke and how my own path lacked these advantages.",STUDENT VOICES COLUMNS,https://www.dukechronicle.com/article/2023/09/090623-green-stem-privilege
Duke needs to end legacy admissions,Heidi Smith,2023-09-05,Duke is an elite American college and thus must be politically correct 100% of the time; this professed commitment to diversity is directly at odds with the latent goal of perpetuating the university in its intended form.,STUDENT VOICES COLUMNS,https://www.dukechronicle.com/article/2023/09/090523-smith-duke-legacy-admission
North Carolina legislator pay is a problem,Holden Buchanan,2023-09-05,"Increasing legislator pay would not prevent self-serving politicians from running for office, but it would introduce a financial incentive that would both increase the pool of candidates and provide a counterweight to the perverse incentive of special interests.",GUEST COLUMNS,https://www.dukechronicle.com/article/2023/09/090523-buchanan-nc-legislator-pay
"One shot, many wounded",Andrew Sun,2023-09-05,"The roughly 5,000 new first-years at UNC, some dear friends included, experienced their welcome-to-college hurrah running for cover in the basement of their nearest building as they decided whether to text home.",GUEST COLUMNS,https://www.dukechronicle.com/article/2023/09/090523-sun-unc-shooting-empathy
Letter: No more thoughts and prayers,Emily Ford,2023-09-04,"The day of the shooting at UNC is a day I will never forget ... It was the first time that I looked at the news and said, “Wow. It could have been me.” ",LETTERS TO THE EDITOR,https://www.dukechronicle.com/article/2023/09/090123-ford-unc-shooting-letter
Make a life,Luke A. Powery,2023-08-28,To make a life is different from making a living.,STUDENT VOICES COLUMNS,https://www.dukechronicle.com/article/2023/08/082823-powery-make-life
Why you should care about the General Assembly,Holden Buchanan and Katherine Gallagher,2023-08-23,"By offering a synopsis of this legislative session, we hope Duke students will recognize how the decisions being made in that building are directly impacting their lives and others around the state.",GUEST COLUMNS,https://www.dukechronicle.com/article/2023/08/082323-buchanan-gallagher-general-assembly
"Duke's statement on North Carolina's 12-week abortion restriction is necessary, not 'inappropriate'",Savannah Marciezyk,2023-06-15,Duke University has an obligation to provide guidance and resources around reproductive health which meet nationally-accepted standards of care.,GUEST COLUMNS,https://www.dukechronicle.com/article/2023/06/061523-marciezyk-abortion-restriction-article-response
Duke's statement on North Carolina's new abortion restriction is inappropriate,Paige Brasington,2023-06-08,"By sending this email voicing opposition to North Carolina’s new law, Duke signals that many viewpoints are not welcome here.",GUEST COLUMNS,https://www.dukechronicle.com/article/2023/06/060823-brasington-abortion-restriction-statement
"Fortifying yourself, and other impossible lessons",Sasha Richie,2023-05-08,"Being a woman in leadership, especially in a male-dominated industry, is often a gunfight you were given a knife for. ",STUDENT VOICES COLUMNS,https://www.dukechronicle.com/article/2023/05/richie-fortifying-yourself-and-other-impossible-lessons
Standing still,Milla Surjadi,2023-05-06,"So perhaps the measure of our devotion — to a piece of writing, to an institution, to an industry — is our belief in its potential. When you stand still and look around, what do you see in the negative space? ",STUDENT VOICES COLUMNS,https://www.dukechronicle.com/article/2023/05/surjadi-standing-still-farewell-column
Durham must address the urban heat island effect and equity in its development ordinances,Chloe Brenner,2023-05-05,"In order to mitigate the negative effects of extreme heat and ensure that communities of color are adequately protected, Durham must amend its city Tree Ordinance and collaborate with vulnerable communities to target planting.",GUEST COLUMNS,https://www.dukechronicle.com/article/2023/05/050523-brenner-durham-tree-ordinance
Duke should offer ASL as a language,Jocelyn Chin,2023-05-02,"American Sign Language should be formally taught at Duke because it is practical, increases accessibility, and contains a rich history and diverse community that students would benefit to learn from.",STUDENT VOICES COLUMNS,https://www.dukechronicle.com/article/2023/05/chin-05022023-duke-should-offer-asl-language
All Durham needs is love and crosswalks ,Katherine Gallagher,2023-05-02,"What was the Beatles' greatest accomplishment? It was neither selling over 1 billion records worldwide, nor revolutionizing the entire music industry nor becoming a major symbol of the 1960s social and cultural transformation. What people don't realize is that John Lennon, Paul McCartney, George Harrison and Ringo Starr were actually pioneers of public safety. ",GUEST COLUMNS,https://www.dukechronicle.com/article/2023/05/050223-gallagher-durham-walkability
The most talented room on campus,Em Adler,2023-05-01,"As long as Chronicle Sports exists, some immensely talented handful of friends will always be walking across the quad at some obscenely early hour in the morning. And the sun will always rise over Abele Quad.",STUDENT VOICES COLUMNS,https://www.dukechronicle.com/article/2023/05/050123-adler-talented-room-campus
Feeling burnt out? Lessons from Latino culture on the politics of rest ,Luna Abadía,2023-05-01,"If you really think about it, the only choice we have is rest.",GUEST COLUMNS,https://www.dukechronicle.com/article/2023/05/050123-abadia-latino-culture-rest
Duke alumni letter supporting the Duke Graduate Students Union,Gino Nuzzolillo,2023-04-28,We pledge to cease our donations and other forms of in-kind support to the University until Duke ends its obstruction of graduate student workers’ right to unionize and collectively bargain.,GUEST COLUMNS,https://www.dukechronicle.com/article/2023/04/042623-alumni-letter-supporting-dgsu
Isn’t it nice?,Leah Boyd,2023-04-26,"In reality, moments, they are beautiful and fleeting and raw, but they say nothing, really. It is our job to bring them to life.",STUDENT VOICES COLUMNS,https://www.dukechronicle.com/article/2023/04/boyd-isnt-it-nice
One last story to tell,Jonathan Levitan,2023-04-26,"Family is behind every great story in sports, from San Francisco to Philadelphia to Durham. It’s behind my story, too.",STUDENT VOICES COLUMNS,https://www.dukechronicle.com/article/2023/04/levitan-one-last-story-to-tell
In the clouds,Marina Chen,2023-04-26,"It's a gift to take a step back with a columnist, to help them look at that puffy, wet wisp of an idea and condense it until it becomes water. ",STUDENT VOICES COLUMNS,https://www.dukechronicle.com/article/2023/04/chen-in-the-clouds
My leap of faith,Katie Tan,2023-04-26,"When the clock strikes midnight, the realization that my tenure has come to an end will slowly sink in, and I’ll reflect with certainty on how taking that leap of faith was the best decision I have ever made.",STUDENT VOICES COLUMNS,https://www.dukechronicle.com/article/2023/04/tan-my-leap-of-faith
Something bigger than ourselves ,Kathryn Thomas,2023-04-26,"The work of student journalism is never done; it only changes hands again, again, and again. One-hundred-and-eighteen times to be exact. ",STUDENT VOICES COLUMNS,https://www.dukechronicle.com/article/2023/04/thomas-something-bigger-than-ourselves
The ballad of twenty,Ooha Reddy,2023-04-26,"At twenty, I am confident and lost, and at twenty, my mother got married.",STUDENT VOICES COLUMNS,https://www.dukechronicle.com/article/2023/04/042623-reddy-the-ballad-of-twenty
The art of seeing  ,Chris Kuo,2023-04-24,Each of us must find our way of living and loving attentively — our own way of spotting the many pennies of this world.,STUDENT VOICES COLUMNS,https://www.dukechronicle.com/article/2023/04/230424-kuo-the-art-of-seeing
The Chronicle gave me so much,Jake C. Piazza,2023-04-24,"Thanks to The Chronicle, I got a front-row seat, many times literally, to witness and document all of this and more. ",STUDENT VOICES COLUMNS,https://www.dukechronicle.com/article/2023/04/230424-piazza-the-chronicle-gave-me-so-much
Being part of something that will outlast all of us,Parker Harris,2023-04-24,Nowhere else will you so readily be equipped to do so much.,STUDENT VOICES COLUMNS,https://www.dukechronicle.com/article/2023/04/042423-harris-being-part-of-something-that-will-outlast-all-of-us
Four years in 700 words,Alex Jackson,2023-04-24,All I really have to say is that I'm thankful for the opportunities I had here.,STUDENT VOICES COLUMNS,https://www.dukechronicle.com/article/2023/04/042423-jackson-four-years-in-700-words
I’m not going birding (and why I belong here anyways),Jonathan Pertile,2023-04-24,"I hate to break it to everyone, but all y’all Duke students are so exceptional.",STUDENT VOICES COLUMNS,https://www.dukechronicle.com/article/2023/04/042423-pertile-im-not-going-birding-and-why-i-belong-here-anyways
No one reads Monday Monday anyway,Monday Monday and Chase Pellegrini de Paur,2023-04-24,AI wrote this column and is now coming to steal your girlfriend. Humans are causing a mass extinction event. The world is burning. Boo. Whatever. No one reads The Chronicle. No one reads the anonymous satirist. ,STUDENT VOICES COLUMNS,https://www.dukechronicle.com/article/2023/04/230424-no-one-reads-monday-monday-anyway
How did we get here?,Babu Chatterjee,2023-04-24,It is not possible to do this by accident. To experience everything takes at least ninety minutes.,STUDENT VOICES COLUMNS,https://www.dukechronicle.com/article/2023/04/042423-chatterjee-how-did-we-get-here
Four years of highlights,Max Rego,2023-04-24,"In between all the talk about the latest news coming out of Duke athletics, I was able to form lasting friendships, friendships that will continue well after graduation.",STUDENT VOICES COLUMNS,https://www.dukechronicle.com/article/2023/04/042423-rego-four-years-of-highlights
I joined Recess by mistake. I’m so glad that I did. ,Ben Smith,2023-04-24,"""Why not,"" I said. I never did go to any other department meetings.",STUDENT VOICES COLUMNS,https://www.dukechronicle.com/article/2023/04/042523-smith-i-joined-recess-by-mistake-im-so-glad-that-i-did
That time I reviewed music for two years,Rhys Banerjee,2023-04-24,"I’ve, without a doubt, enjoyed my time writing for the Duke Chronicle. Despite this, after I graduate, I’ll probably never write another music review again.",STUDENT VOICES COLUMNS,https://www.dukechronicle.com/article/2023/04/042423-banerjee-that-time-i-reviewed-music-for-two-years
SHAPE's demands to administrators for a safer Duke,Duke SHAPE,2023-04-18,"We want to see the day when Duke doesn’t need SHAPE. Until then, SHAPE will be on the front line igniting cultural and institutional, survivor-centric change.",GUEST COLUMNS,https://www.dukechronicle.com/article/2023/04/230417-duke-shape-demands-sexual-harassment-assault-prevention-education
47 seconds is the average…and it shouldn’t be,Linda Cao,2023-04-18,"With our minds quickly switching to the next tab, moving onto the next big trend, our focus shifts horrifically easy. ",STUDENT VOICES COLUMNS,https://www.dukechronicle.com/article/2023/04/041823-cao-47-seconds-average
A letter from you one day soon,Advikaa Anand,2023-04-18,"Because as you will soon realize, to grow up and become who you were meant to be and not merely someone’s child, someone’s friend, someone’s sibling, you have to do life on your own. ",STUDENT VOICES COLUMNS,https://www.dukechronicle.com/article/2023/04/041823-anand-a-letter-from-you-one-day-soon
Joy on the journey,Luke A. Powery,2023-04-17,Nearing the end of the semester — with graduation approaching for some — I suspect many students experience some mixture of fear and joy at the uncertainty of what lies ahead.,STUDENT VOICES COLUMNS,https://www.dukechronicle.com/article/2023/04/031723-end-of-year
Recognizing Duke Theater’s scene and costume shops ,Ash Jeffers,2023-04-17,"The Shops, David, and Erin were integral to my experience at Duke, for and beyond everything they taught me about theater.",GUEST COLUMNS,https://www.dukechronicle.com/article/2023/04/041423-jeffers-theater-costume-shops
Climate change is irreversible; we need to bang right now,Monday Monday,2023-04-16,"Whether you’re reading this on a Monday night or a Thursday morning, it is absolutely essential that you and I engage in amazing and consensual sex before our planet is consumed by the biblically foretold devastation of climate destruction. ",STUDENT VOICES COLUMNS,https://www.dukechronicle.com/article/2023/04/230417-monday-monday-please-text-me
A fair-weather campus,Heidi Smith,2023-04-16,"Clearly, we don’t owe a friend the same commitment as a boyfriend, but is a single 30-minute lunch once a week despite all else going on too much to ask?",STUDENT VOICES COLUMNS,https://www.dukechronicle.com/article/2023/04/04012023-smith-fair-weather-campus
We can't accept defeat in the fight for immigration reform,Sofia Cava,2023-04-14,"As we asked question after question hoping to hear at least one encouraging response, we were repeatedly told that the issue of immigration was too complex and politicized to address at this time.",GUEST COLUMNS,https://www.dukechronicle.com/article/2023/04/041323-cava-immigration-reform
Ozempic: blood sugar stabilizer or miracle weight-loss drug?,Monika Narain,2023-04-14,"As Ozempic comes out of shortage, will patients and healthcare professionals be more responsible in rationing prescriptions to those who need them for medical over cosmetic reasons? ",STUDENT VOICES COLUMNS,https://www.dukechronicle.com/article/2023/04/041423-narain-ozempic-blood-sugar-stabilizer-or-miracle-weight-loss-drug
On the silence from Duke admin on the proposed North Carolina abortion ban,Duke Planned Parenthood Generation Action Exec,2023-04-13,"House Bill 533, also known as the “The Human Life Protection Act”, was proposed by Rep. Keith Kidwell (R-Beaufort) very recently... 1 in 4 women will receive abortions in their lives, and Duke students are no exception to that statistic.",GUEST COLUMNS,https://www.dukechronicle.com/article/2023/04/041323-planned-parenthood-generation-action-exec-proposed-nc-abortion-ban
Your disdain for Durham is embarrassing,Pilar Kelly,2023-04-11,"When we Duke students leave our big cities and subdivisions behind and then complain about Durham, we reek of the entitlement and prejudice that has soured our relationship with this city and earned Duke names such as New Jersey University.",STUDENT VOICES COLUMNS,https://www.dukechronicle.com/article/2023/04/041123-kelly-duke-disdain
"First nuts, now unions: Duke admin continues attempts to bust",Monday Monday,2023-04-10,"“Being an employee does not necessarily make you an employee,” said the provost. “Nugget, the beloved canine who was arguably golden and sometimes appeared to retrieve things, was not necessarily legally a golden retriever.""",STUDENT VOICES COLUMNS,https://www.dukechronicle.com/article/2023/04/230409-monday-monday-union-busting
The GOP doesn’t care about you,Katelyn Sheets,2023-04-07,"My plea to Duke students, and really anyone in North Carolina, is to stay vigilant and speak out in support of common sense gun legislation.",GUEST COLUMNS,https://www.dukechronicle.com/article/2023/04/030723-sheets-nashville-desantis
Voting time extended for DSG elections,DSG Board of Elections,2023-04-06,We are extending voting time until 2 pm EST this afternoon to account for the time we took to fix and publicize the ballot. ,GUEST COLUMNS,https://www.dukechronicle.com/article/2023/04/230406-dsg-voting-time-extended-for-dsg-elections
"Death, passion, and Lamentations: Some reflections on Holy Week",Matthew Arakaky,2023-04-06,"Christ’s refusal to circumvent the question of suffering allows us to suffer well...We can repeat the same phrase back to Him: “Lord, this is my body…broken for You.”",GUEST COLUMNS,https://www.dukechronicle.com/article/2023/04/040623-arakaky-lamentations-holy-week-reflections
(Ongoing legal) actions speak louder than words,Duke Graduate Students Union Press Team,2023-04-05,"Duke could voluntarily recognize our union, or follow word with substantive action by dropping the NLRB challenge and committing the basic resources needed to hold elections now.",LETTERS TO THE EDITOR,https://www.dukechronicle.com/article/2023/04/040523-duke-graduate-students-union-nlrb-unionization-ongoing-legal-actions-speak-louder-than-words
If I die in a school shooting,Caroline Cornett,2023-04-03,"Don’t call me a daughter, or sister, or friend; call me a victim of the NRA and the people who would rather protect their right to own an assault rifle than the lives of their fellow human beings. ",STUDENT VOICES COLUMNS,https://www.dukechronicle.com/article/2023/04/040423-cornett-in-a-school-shooting
A pillow for love,Luke A. Powery,2023-04-03,The tears being shed in Nashville and the tears cried here on campus...are never wasted because every drop forms a pillow for your heart of love.,STUDENT VOICES COLUMNS,https://www.dukechronicle.com/article/2023/04/040323-powery-pillow-for-love
