title,author,date,abstract,column,url
All the world’s a stage,Anna Garziera,2024-02-22,"If we acted exactly the same around all of our acquaintances, we’d have very few colleagues and even fewer friends.",STUDENT VOICES COLUMNS,https://www.dukechronicle.com/article/2024/02/022124-garziera-world-stage
Words that matter: For Alexei Navalny,Carol Apollonio,2024-02-22,"In some places, the Word matters. It lives in a tangible physical world where when you speak your truth, you will be exiled; dispossessed; brutally beaten; shot dead on the street ...",STUDENT VOICES COLUMNS,https://www.dukechronicle.com/article/2024/02/022124-apollonio-words-matter-navalny
Which would you save: Friend or romantic partner?,Jess Jiang,2024-02-22,"Love shouldn’t be hierarchical, with romantic love as the pinnacle transcending other types of love.",STUDENT VOICES COLUMNS,https://www.dukechronicle.com/article/2024/02/022124-jiang-platonic-romantic-love
Happiness is not what you’re looking for,Paul Dilly,2024-02-21,"We hinge our contentment on what we think we need, rather than what we have. The world doesn’t make us unhappy. We do. ",STUDENT VOICES COLUMNS,https://www.dukechronicle.com/article/2024/02/022024-dilly-dont-look-for-happiness
Closing Duke's Herbarium: A fear of long-term climate commitment?,Matthew Johnson,2024-02-21,"Without the Herbarium, and support for future faculty in biodiversity research, Duke’s reputation in this area will wither on the vine.",LETTERS TO THE EDITOR,https://www.dukechronicle.com/article/2024/02/022024-johnson-closing-duke-herbarium
CS Majors launch 'ambiguous and labelless relationship' pact ,Monday Monday,2024-02-20,"Unlike traditional Marriage Pact tests, the Blue Devil Situationship Match (BDSM) Program involves open-ended questions analyzed by AI to better match you to the perfect non-exclusive, uncommunicative, not-committal partner.",STUDENT VOICES COLUMNS,https://www.dukechronicle.com/article/2024/02/021924-monday-monday-relationship-pact
The fear of being single,Heidi Smith,2024-02-20,But it truly is better to be single than to be in a bad relationship. Because being single doesn’t mean being alone unless you choose to make it that way.,STUDENT VOICES COLUMNS,https://www.dukechronicle.com/article/2024/02/021924-smith-being-single-fear
Save the Duke Herbarium,Henry Van T. Cotter,2024-02-17,"The Duke Herbarium is such an asset, and its loss would be to the detriment of Duke’s reputation as a leading scientific research university.",LETTERS TO THE EDITOR,https://www.dukechronicle.com/article/2024/02/021624-cotter-save-duke-herbarium
What Duke can learn from retiring ex-president Ricardo Lagos,Robert Carlson,2024-02-17,"In Duke’s 100-year history, only two alumni have gone on to become heads of state. One is ... Ricardo Lagos, a largely overlooked alumnus whose life should inspire Duke students, faculty, staff and alumni throughout the next 100 years.",GUEST COLUMNS,https://www.dukechronicle.com/article/2024/02/021624-carlson-ricardo-lagos
"Love, love",Gabrielle Mollin,2024-02-16,"Somehow in a culture that is constantly expressing love, from the most serious of romantic partners to best friends to valued material goods, we have denied the legitimacy of love beyond romance.",STUDENT VOICES COLUMNS,https://www.dukechronicle.com/article/2024/02/021524-mollin-love-valentines-day
The merits and pitfalls of lines,Nathan Luzum,2024-02-16,"There are days when I stroll down the Bryan Center Plaza, see a bunch of people filing up to a table, and figure why not? I’ll get in line because it’s probably something pretty good, like Monuts. Even a clicky pen is passable.",STUDENT VOICES COLUMNS,https://www.dukechronicle.com/article/2024/02/021524-luzum-merits-pitfalls-lines
Do you really love me?,Advikaa Anand,2024-02-16,I’ve always been disturbed by how casually people will say “I love you.”,STUDENT VOICES COLUMNS,https://www.dukechronicle.com/article/2024/02/021524-anand-do-you-really-love-me
The Allen Building Takeover: The second founding of Duke University,Theodore D. Segal,2024-02-13,"In this centennial year, we will celebrate James B. Duke and others who have laid the groundwork for the university. But we must also honor the Black students who risked everything to occupy the Allen Building 55 years ago.",GUEST COLUMNS,https://www.dukechronicle.com/article/2024/02/021324-segal-allen-building-anniversary
What QuadEx needs to be great,Nicholas Chrapliwy,2024-02-13,"My hope is that Duke will have the bold leadership and creative vision to grow these seeds of belonging into some mature and flourishing evergreens, so that QuadEx may one day be a name for something beloved and lasting. Until then, students, alumni, and other university stakeholders should continue to be critical and insist that we can do better. I know I will.",STUDENT VOICES COLUMNS,https://www.dukechronicle.com/article/2024/02/021324-chrapliwy-quadex
The cold never bothered me anyway,Anna Sorensen,2024-02-13,"If everyone took a five minute shower with cold water for the next academic year, we would save roughly 16,268,000 gallons of water. Duke could also save $322,106.",STUDENT VOICES COLUMNS,https://www.dukechronicle.com/article/2024/02/021324-sorensen-cold-never-bothered-me-anyway
Attention is most of all you need,Angikar Ghosal,2024-02-12,"Technological accelerationism devoid of introspection effectuates irreversible transformations in societal structures, cultural paradigms and axiological frameworks.",STUDENT VOICES COLUMNS,https://www.dukechronicle.com/article/2024/02/021224-ghosal-attention-all-you-need
"Black History Month, Valentine's Day and love",Luke A. Powery,2024-02-12,"Roses or chocolates may be fine as gifts for Valentine’s Day this week, but a real gift you can give someone or yourself is to show through action, “I want you to live.”",STUDENT VOICES COLUMNS,https://www.dukechronicle.com/article/2024/02/021224-powery-love-practice-resistance
Elko Urbanism: The end of an era?,Aaron Siegle,2024-02-09,Keeping the Card Lot open to student festivities would be an apt tribute to Elko’s legacy.,STUDENT VOICES COLUMNS,https://www.dukechronicle.com/article/2024/02/020924-siegle-elko-urbanism-the-end-of-an-era
The danger of casual psychopathology,Monika Narain,2024-02-08,Mental health professionals not only have the job of being successful healers but also adaptive wordsmiths.,STUDENT VOICES COLUMNS,https://www.dukechronicle.com/article/2024/02/020824-narain-danger-casual-psychopathology
Less is more,Anna Garziera,2024-02-07,"FOMO is going around faster than the flu these days, with everything from Rush to UNC games to miss out on. However, by releasing unnecessary obligations, college life will start to feel a lot more manageable.",STUDENT VOICES COLUMNS,https://www.dukechronicle.com/article/2024/02/020724-less-is-more
Attention and morality,Jess Jiang,2024-02-07,"If one doesn’t bother to think, one may not even realize that one’s actions are deeply wrong.",STUDENT VOICES COLUMNS,https://www.dukechronicle.com/article/2024/02/020724-jiang-attention-morality
The best and worst dining options on West Campus (a ranking),Alex Berkman,2024-02-06,"I can confidently say that “The Chef’s Kitchen” has had one of the greater glow ups in recent memory, in its transition from It’s Thyme to the ‘Hawaiian Place.’ “It’s actually really good, I promise. Just give it a chance.” I have given it a chance. I have given it seven chances.",STUDENT VOICES COLUMNS,https://www.dukechronicle.com/article/2024/02/020624-berkman-ranking-wu
Line monitors implement strict 'No Meanies Allowed' rule in K-Ville ,NA,2024-02-05,“Some people say K-Ville’s gone soft. But I say the line monitors are harder than ever!”,STUDENT VOICES COLUMNS,https://www.dukechronicle.com/article/2024/02/020524-monday-monday-line-monitors
Stop being late,Heidi Smith,2024-02-05,"Because it’s not just about being late … this is one of many ways we, as Duke students, have collectively decided to put ourselves over others.",STUDENT VOICES COLUMNS,https://www.dukechronicle.com/article/2024/02/020424-smith-stop-being-late
Lessons in love and letting go: The college 'situationship',Barbara Cardenas,2024-02-05,We often need to feel the heat of the fire firsthand before we truly understand why we were warned against it.,STUDENT VOICES COLUMNS,https://www.dukechronicle.com/article/2024/02/020524-cardenas-lessons-situationship
"Give It’s Thyme a chance, but always remember Panda Express",Jessica Luan,2024-02-02,"It’s a shame that Panda is gone, but it’s also a shame that It’s Thyme’s arrival — what should have been an exciting occasion — coincided with the elimination of Panda Express.",STUDENT VOICES COLUMNS,https://www.dukechronicle.com/article/2024/02/020224-luan-remember-panda-express
To: me. Love: me,Advikaa Anand,2024-02-01,"As I delve deeper and deeper into adulthood, it seems to me that our self-identities and perceptions are increasingly contingent on our relationships with others. ",STUDENT VOICES COLUMNS,https://www.dukechronicle.com/article/2024/02/020124-anand-to-me-love-me
What’s under the rock,Carol Apollonio,2024-01-31,"There are some terrifying thoughts lurking down there, kind of like when you are out by the creek and flip over a rock and see all the creepy-crawlies underneath. Homicidal urges, illicit desires, feelings of guilt, revenge, or dread, tabooed thoughts about Apocalypse.",STUDENT VOICES COLUMNS,https://www.dukechronicle.com/article/2024/01/013124-apollonio-under-rock
The strange nostalgia of 20,Anna Sorensen,2024-01-30,"I am excited to see what lessons my twenties hold in store for me, and I secretly hope that they’re a bit of a rollercoaster.",STUDENT VOICES COLUMNS,https://www.dukechronicle.com/article/2024/01/013024-sorensen-strange-nostalgia-of-twenty
Strangers as angels,Luke A. Powery,2024-01-29,"You might be experiencing tough times, your own wilderness. But I hope you don’t miss the deacons of God in your midst.",STUDENT VOICES COLUMNS,https://www.dukechronicle.com/article/2024/01/012924-powery-strangers-angels
Personality tests and the absurdity of self-awareness,Monika Narain,2024-01-29,"Personality tests aren’t “scientific,” but self-understanding isn’t meant to be a scientific process.",STUDENT VOICES COLUMNS,https://www.dukechronicle.com/article/2024/01/012924-narain-personality-tests-self-awareness
The case of overstimulation,Angikar Ghosal,2024-01-29,Intellectual posturing is almost always an offense and is only legal and celebrated for existing intellectuals who are already famous.,STUDENT VOICES COLUMNS,https://www.dukechronicle.com/article/2024/01/012924-ghosal-case-of-overstimulation
In defense of the university,James Gao,2024-01-26,"This is the central paradox of the elite university: It is simultaneously America’s crown jewel and its black sheep, an embodiment of everything this country can achieve and everything it has failed to thus far.",STUDENT VOICES COLUMNS,https://www.dukechronicle.com/article/2024/01/012624-gao-elite-universities-defense
The art of music snobbery,Susan Chemmanoor,2024-01-26,"The music crescendos and suddenly you’re there. You’re standing on a rain-soaked road and the daylight is dead, but you finally feel alive.",STUDENT VOICES COLUMNS,https://www.dukechronicle.com/article/2024/01/012624-chemmanoor-mitski-music-emotions
Under these towering oaks no more ,Aaron Siegle,2024-01-26,The oaks have survived the first hundred years of Duke’s turbulent history. Let’s make sure they’ll be around one hundred years from now.,STUDENT VOICES COLUMNS,https://www.dukechronicle.com/article/2024/01/012624-siegle-under-towering-oaks-no-more
A realist's perspective on grade inflation,Alex Berkman,2024-01-25,"Not only does hyper grade inflation diminish the value of true achievement, it also shields us from a reality that does not deliberately accommodate our success.",STUDENT VOICES COLUMNS,https://www.dukechronicle.com/article/2024/01/012524-berkman-grade-inflation-prevent-learning
We will not wait for the next school shooting,Andrew Sun and Alexander Denza,2024-01-24,It's not simply our lives we protect with prose and protest. It is our way of life itself.,GUEST COLUMNS,https://www.dukechronicle.com/article/2024/01/012424-sun-denza-school-shooting
Motivation isn’t enough: Here’s how to achieve your goals,Anna Garziera,2024-01-24,"At the end of the day, it is not our future self that will be asked to work towards that goal, but our current self.",STUDENT VOICES COLUMNS,https://www.dukechronicle.com/article/2024/01/012424-garziera-motivation-not-enough
New pre-professional society to focus on bumming around,Monday Monday,2024-01-22,"While most pre-professional societies do not have a residential section, Beta Upsilon Mu members creatively promote residential connections by commandeering a new common room to couch-surf in every week.",STUDENT VOICES COLUMNS,https://www.dukechronicle.com/article/2024/01/012224-monday-monday-pre-professional-society
I'm glad It's Thyme replaced Panda ,Heidi Smith,2024-01-22,"No matter what type of cuisine it models, adding a restaurant that is trying to serve real food is an unambiguous win in my book.",STUDENT VOICES COLUMNS,https://www.dukechronicle.com/article/2024/01/012224-smith-glad-its-thyme-replaced-panda
DukeEngage DC Democracy at Risk: An unlikely ally,Gabrielle Mollin,2024-01-19,"I’m miles away from identifying with the Republican party, but I can no longer impose false narratives onto their voter base.",STUDENT VOICES COLUMNS,https://www.dukechronicle.com/article/2024/01/011924-mollin-democracy-unlikely-ally
Banning ChatGPT won’t stop cheating,Aaron Price,2024-01-19,"If classes continue to fail to provide the value students hope to derive from college, it won’t matter if AI is banned or not. Students will always find a way to cheat.",STUDENT VOICES COLUMNS,https://www.dukechronicle.com/article/2024/01/011924-price-banning-chatgpt-cheating
It’s not too soon to say that QuadEx is failing,Gabriel Reis,2024-01-19,"Two years into QuadEx implementation and we are worse than where we started, with nearly zero residential excitement on this campus.",GUEST COLUMNS,https://www.dukechronicle.com/article/2024/01/011924-reis-quadex-failing
"At Duke, we serve ourselves",Advikaa Anand,2024-01-18,"Mandating service work as a graduation requirement would help diffuse the concentrated tensions around career building and professionalism to a useful cause, skillfully deploying Duke students’ talents in arenas where they can do good.",STUDENT VOICES COLUMNS,https://www.dukechronicle.com/article/2024/01/011824-anand-we-serve-ourselves
Books will set you free,Carol Apollonio,2024-01-17,"I am kind of thinking that bitcoins themselves are a cheap form of fiction, but considerably less interesting than a random short story by a mildly talented writer.",STUDENT VOICES COLUMNS,https://www.dukechronicle.com/article/2024/01/011724-apollonio-skeptical-books
Olive Garden as a metaphor for life,Nathan Luzum,2024-01-17,"Perhaps it’s sad to be in your mid-20s and have a well-honed strategy for getting your money’s worth out of a chain restaurant, but I choose to think of it as one of my charming qualities.",STUDENT VOICES COLUMNS,https://www.dukechronicle.com/article/2024/01/011724-luzum-olive-garden
Letter from alumni: A response to Duke Students Supporting Israel,"Mark Pinsky , Jeffrey Gold and Douglas Schocken",2024-01-16,"In light of our view that there is no military solution to the Israel-Gaza War, we understand the calls for an immediate cease-fire. What is needed, however, is a fundamentally different discourse — one that recognizes the multiple conflicting truths and complexities that inextricably bind us as Israeli and Diaspora Jews and Palestinians.",GUEST COLUMNS,https://www.dukechronicle.com/article/2024/01/011624-gold-pinsky-schocken-letter
In memory of Martin Luther King Jr.: The wise caution of amos (especially to religious folk),Luke A. Powery,2024-01-15,"In his famous “I Have a Dream” speech, Martin Luther King Jr. quoted the prophet Amos, saying, “Justice rolls down like waters, and righteousness like a mighty stream.”",STUDENT VOICES COLUMNS,https://www.dukechronicle.com/article/2024/01/011524-powery-martin-luther-king-jr-memory
The road to Wagner,Angikar Ghosal,2024-01-15,I have long considered the capacity to fervently sob to the prelude of ‘Tannhäuser’ as an indicator of virtuous moral character.,STUDENT VOICES COLUMNS,https://www.dukechronicle.com/article/2024/01/031524-ghosal-road-to-wagner
When we are betrayed: Who to be and what to do?,Allegra Jordan and Theodore Ryan,2023-12-18,"We must also honor that we have invisible, moral injuries from how former Duke Football Coach Mike Elko left us.",GUEST COLUMNS,https://www.dukechronicle.com/article/2023/12/121823-jordan-ryan-elko-betrayal
Letter to Duke football players: Don't ever give up,Richard Byrd,2023-12-12,I can't imagine how difficult it must be for those of you who are facing the prospect of a third coaching staff in your time at Duke and are being asked to trust another group of coaches.,LETTERS TO THE EDITOR,https://www.dukechronicle.com/article/2023/12/101223-byrd-duke-football-letter
"'We've heard enough': The Chronicle to end 'Student Voices' columns, Monday Monday reports",Monday Monday,2023-12-11,Duke students have lived their whole lives being told they are smarter and more interesting than the average person. Opinion columnists dare to challenge this and say: “Untrue! Our opinions are just as boring as everyone else’s.” ,STUDENT VOICES COLUMNS,https://www.dukechronicle.com/article/2023/12/121123-monday-monday-ending-student-voices
In defense of neutral space,Marc Brettler,2023-12-11,"Participants in the event — spanning a broad swath of political, religious, socio-economic and ethnic divides — called for more spaces at Duke in which to engage in civil discourse with people other people with differing viewpoints.",GUEST COLUMNS,https://www.dukechronicle.com/article/2023/12/101123-brettler-neutral-space-defense
A defense of the foreign language requirement,Henry Pickford,2023-12-11,"Foreign language and, more importantly, acquiring the higher-level experiences that are enabled by that facility in the foreign language — study abroad, engagement with intellectual works in the foreign language, etc. — should be an essential part of a liberal arts education.",GUEST COLUMNS,https://www.dukechronicle.com/article/2023/12/101123-pickford-foreign-language-requirement
No place like home,Valerie Tan,2023-12-08,Home was a place I had worked tirelessly and pleaded fervently to leave as soon as I was old enough to realize that the option existed.,STUDENT VOICES COLUMNS,https://www.dukechronicle.com/article/2023/12/120823-tan-no-place-like-home
The convenience of more,Aaron Siegle,2023-12-08,"Commitment takes dedication, and dedication isn’t efficient.",STUDENT VOICES COLUMNS,https://www.dukechronicle.com/article/2023/12/120823-siegle-convenience-of-more
"Duke's commitment is to fossil fuels, not the climate",Duke Climate Coalition,2023-12-08,"Duke needs to cut all ties with fossil fuel companies to ensure that it is actively supporting climate action and decarbonization, rather than playing into the interests of big oil.",GUEST COLUMNS,https://www.dukechronicle.com/article/2023/12/100823-duke-climate-coalition
Statement from Duke Students Supporting Israel: Israel has a right to defend itself against terrorism,Duke Students Supporting Israel,2023-12-07,Atrocities on both ends further emphasize our wish and the emphatic need for everyone — Israelis and Palestinians alike — to be free from Hamas.,GUEST COLUMNS,https://www.dukechronicle.com/article/2023/12/100723-duke-students-supporting-israel
Don’t limit thankfulness to a Thursday in November,Anna Garziera,2023-12-06,"As a rule of thumb, this is exactly what gratefulness affords us: a better perspective. By pinpointing what is most important to us, daily battles feel relatively insignificant.",STUDENT VOICES COLUMNS,https://www.dukechronicle.com/article/2023/12/120623-garziera-dont-limit-thankfulness-to-november
Tunnel to DKU at former Panda Express site nears completion ,Monday Monday,2023-12-04,"After being a staple of dining for Duke students who loved underseasoned chicken for 15 years, Panda Express served its last rice bowl last May, leaving a gaping hole that has been under constant renovation ever since.",STUDENT VOICES COLUMNS,https://www.dukechronicle.com/article/2023/12/120423-monday-monday-dku-tunnel-panda-express
Singing the blues,Luke A. Powery,2023-12-04,Singing the blues is an essential ingredient for anyone who wants to prepare for the way life is.,STUDENT VOICES COLUMNS,https://www.dukechronicle.com/article/2023/12/120423-powery-singing-blues
Sandwich smackdown: Pitchfork’s fried chicken sandwich wins gold,Jessica Luan,2023-12-01,"There are definitely better fried chicken sandwiches out there, like at the Popeye’s at RDU or Cane’s on Franklin Street. But the Pitchforks sandwich is bewitchingly delicious, easily accessible and better than its on-campus competitors. ",STUDENT VOICES COLUMNS,https://www.dukechronicle.com/article/2023/12/120123-luan-pitchforks-fried-chicken-sandwich
Have yourself a crafty Christmas,Morgan Foster,2023-12-01,"With reports of a cool-down in consumer spending coming out of last week's Black Friday, I imagine more people will forgo store-bought gifts — not out of protest, but out of necessity.",STUDENT VOICES COLUMNS,https://www.dukechronicle.com/article/2023/12/120123-foster-crafty-christmas
Gatsbys at Duke University,Advikaa Anand,2023-11-30,"I don’t know why I have cared more about my physical appearance since coming here, but I do reckon it's something to do with the overall preppy, classy appearance of the Duke student body.",STUDENT VOICES COLUMNS,https://www.dukechronicle.com/article/2023/11/113023-anand-gatsbys-duke-university
A case against QS,Sonia Green,2023-11-28,"The QS requirement is unnecessary, and doing away with it would give non-STEM students like me more freedom to pursue our academic and career interests.",STUDENT VOICES COLUMNS,https://www.dukechronicle.com/article/2023/11/112823-green-qs-requirement-unnecessary
Do you really need that master's degree?,Heidi Smith,2023-11-27,We have been in the educational system all our lives; how much more can we gain from being a student for one to two more years?,STUDENT VOICES COLUMNS,https://www.dukechronicle.com/article/2023/11/112723-smith-do-you-really-need-that-masters-degree
The case for maximalism,Angikar Ghosal,2023-11-27,"The thing about op-eds is that either an article echoes the overwhelmingly agreed view and did not convince anyone new, or it is an unpopular, hot take … and the article did not convince anyone new!",STUDENT VOICES COLUMNS,https://www.dukechronicle.com/article/2023/11/112723-ghosal-maximalism-case
Ditch your four wheels and get on two: Biking to campus can improve your life,Bridget Gregory,2023-11-20,I implore my off-campus peers to consider biking or even walking instead of driving to campus.,GUEST COLUMNS,https://www.dukechronicle.com/article/2023/11/112023-gregory-biking-improve-life
Common aspirations,Luke A. Powery,2023-11-20,"When applying to college you want to set yourself apart and not be common. This helps you stand out from the pack. But in everyday life, you shouldn’t have to be distinct in order to be accepted.",STUDENT VOICES COLUMNS,https://www.dukechronicle.com/article/2023/11/112023-powery-common-aspirations
We need a better way to get groceries,Zubin Rekhi,2023-11-17,The problem with the administration’s current shuttle model is its prioritization of the bare minimum — keeping students safe on-campus — without respecting any other concerns about students’ time or needs.,STUDENT VOICES COLUMNS,https://www.dukechronicle.com/article/2023/11/111723-rekhi-groceries-campus-transportation
New caps on Duke-approved programs are elitist,Ellie Armstrong and Chris Paré,2023-11-16,The program caps not only add stress to the student body but also promote an elitist socioeconomic culture and a Western superiority complex.,GUEST COLUMNS,https://www.dukechronicle.com/article/2023/11/111623-armstrong-pare-duke-approved-program-caps
Contradicting Elsa: Sometimes it’s okay to not 'Let it Go',Advikaa Anand,2023-11-16,"Ultimately, forgiving someone is not about them; instead, it’s about us — it’s about our choice to rise above the pain that they have caused us, but only when we are ready, if we are ever ready.",STUDENT VOICES COLUMNS,https://www.dukechronicle.com/article/2023/11/111623-anand-sometimes-okay-not-let-it-go
Duke needs to address its failure to identify human rights impacts when investing,Duke Amnesty International,2023-11-15,Duke Amnesty International is calling upon the Duke University Investment Management Company (DUMAC) to take responsibility for ethical decision-making regarding their investment of the Duke endowment.,GUEST COLUMNS,https://www.dukechronicle.com/article/2023/11/111523-amnesty-international-human-rights-due-diligence-investment-lack
Campus buses to install spikes to more easily kill cyclists,Monday Monday,2023-11-13,The new buses feature state-of-the-art spears positioned at the front and side of the buses to perfectly skewer any cyclist or skateboarder who dares to brave Campus Drive.,STUDENT VOICES COLUMNS,https://www.dukechronicle.com/article/2023/11/111323-monday-monday-buses-cyclists
We need to rethink swag,Heidi Smith,2023-11-13,"Getting swag almost feels like being a lab rat pressing a pellet dispenser again and again — sometimes you get a treat, sometimes nothing and sometimes, frankly, a piece of shit that you have to figure out what to do with.",STUDENT VOICES COLUMNS,https://www.dukechronicle.com/article/2023/11/111323-smith-rethink-swag
